{
  "id": "perfect-blue",
  "number": 3,
  "name": "Perfect Blue",
  "reference": "Inspired by WordPerfect 5.1 and 6.0, MS-DOS, 1989",
  "productName": "Perfect Blue",
  "colors": {
    "panel": "#0000aa",
    "panel2": "#0000aa",
    "button": "#c0c0c0",
    "titleBg": "#c0c0c0",
    "titleFg": "#000080",
    "editorBg": "#0000aa",
    "editorFg": "#d8d8d8",
    "statusBg": "#0000aa",
    "statusFg": "#ffffff",
    "menuFg": "#ffffff",
    "menuHoverBg": "#000080",
    "menuHoverFg": "#ffffff",
    "aboutFg": "#ffffff",
    "aboutButtonFg": "#ffffff",
    "selectionBg": "#00ffff",
    "selectionFg": "#000000",
    "hi": "#ffffff",
    "mid": "#c0c0c0",
    "dark": "#808080",
    "deep": "#000080",
    "frameBg": "#0000aa",
    "grip": "#ffffff",
    "aboutBg": "#0000aa",
    "menuActiveBg": "#000080",
    "menuActiveFg": "#fff"
  },
  "uiFont": "\"Courier New\",Courier,monospace",
  "editorFont": "\"Courier New\",Courier,monospace",
  "extraCss": ".window{grid-template-rows:24px 28px minmax(0,1fr) 24px;background:#0000aa;padding:0;border:3px double #000080;box-shadow:none}.titlebar{background:#c0c0c0;color:#000080;font-weight:700;border-top:1px solid #fff;border-bottom:3px double #000080;padding:1px 3px 1px 5px}.title{font-weight:700;text-shadow:none}.icon{display:none}.caption{height:18px;background:#c0c0c0;border:1px solid #000080;box-shadow:none}.caption:active{box-shadow:inset 1px 1px #000080}.menubar{height:28px;align-items:center;background:#c0c0c0;color:#000080;padding:0 3px;border:0;border-bottom:2px solid #000080;box-shadow:none;font-weight:700;overflow:visible;z-index:20}.menubar:after{content:\"(Press F3 for Help)\";margin-left:auto;padding:3px 2px 2px 8px;color:#000080;font-weight:700;white-space:nowrap}.menuwrap{z-index:21}.menubtn{font-weight:700;padding:3px 5px;color:#000080;border:1px solid transparent;box-shadow:none}.menubtn::first-letter{color:#a00000}.menubtn:hover,.menubtn.open{border-color:transparent;background:#000080;color:#fff;box-shadow:none}.menu{top:25px;background:#c0c0c0;color:#000080;border:1px solid #000080;box-shadow:none;z-index:50}.item{font-weight:700}.sep{border-top-color:#808080;border-bottom-color:#fff}.editorframe{margin:0;padding:0;background:#0000aa;box-shadow:none;border:0}textarea{padding:4px 5px;font-size:15px;line-height:1.32;letter-spacing:.1px}textarea::selection,textarea:focus::selection{background-color:#00ffff!important;color:#000!important;-webkit-text-fill-color:#000!important;text-shadow:none!important}.status{margin:0;padding:0 5px;background:#0000aa;color:#fff;box-shadow:none;border:0;font-weight:700}.chars{margin-left:auto}.grip{background:repeating-linear-gradient(135deg,transparent 0 3px,#fff 3px 5px)}.aboutbox{background:#0000aa;color:#fff;border:3px double #c0c0c0;box-shadow:none;padding:0}.abouttitle{background:#c0c0c0;color:#000080;border-bottom:3px double #000080}.aboutbody{background:#0000aa;color:#fff}.winbutton{background:#c0c0c0;color:#000080!important;-webkit-text-fill-color:#000080!important;border:1px solid #000080;box-shadow:none;font-weight:700}@media(max-width:390px){.menubar:after{display:none}.menubtn{padding-left:4px;padding-right:4px}}",
  "editorWeight": "700",
  "schemaVersion": 3,
  "skinnyNote": {
    "icon": {
      "mode": "legacy",
      "showInTitleBar": true,
      "showInAbout": false,
      "text": "N",
      "dataUrl": "",
      "size": 20
    },
    "titleBarLines": {
      "enabled": false,
      "mode": "gap",
      "lineColor": "#000080",
      "gapColor": "#c0c0c0",
      "lineThickness": 2,
      "gapThickness": 2,
      "startWithGap": true,
      "titlePlateColor": "#c0c0c0",
      "applyToAbout": true
    },
    "about": {
      "subtitle": "Compact browser text editor",
      "copyright": "Copyright © 2026 Jives"
    },
    "editorWatermark": {
      "enabled": false,
      "size": 46,
      "opacity": 18
    }
  }
}
